{
  "name": "nidavellir",
  "owner": {
    "name": "AltaKleos Platform Team",
    "email": "hello@altakleos.com"
  },
  "metadata": {
    "description": "AltaKleos Claude Code plugins and tools",
    "version": "1.9.0",
    "repository": "https://github.com/altakleos/nidavellir"
  },
  "plugins": [
    {
      "name": "eitri",
      "source": "./plugins/eitri",
      "description": "Intelligent extension forge that creates precisely optimized Claude Code extensions (skills, agents, suites, hooks, MCP servers, or hybrid solutions) through deep contextual understanding and adaptive intelligence",
      "version": "1.9.2",
      "author": {
        "name": "AltaKleos Platform Team",
        "email": "hello@altakleos.com"
      },
      "category": "development",
      "keywords": ["skill-creation", "factory", "generator", "forge", "adaptive", "intelligent", "hooks", "mcp", "export", "agent-skills", "testing", "sandbox", "diagram", "visualization"]
    },
    {
      "name": "rune",
      "source": "./plugins/rune",
      "description": "Beautiful, correct diagrams and documentation. Auto-generates Mermaid diagrams with intelligent type selection and validated syntax.",
      "version": "1.0.0",
      "author": {
        "name": "AltaKleos Platform Team",
        "email": "hello@altakleos.com"
      },
      "category": "documentation",
      "keywords": ["mermaid", "diagrams", "documentation", "visualization", "flowchart", "sequence", "architecture"]
    },
    {
      "name": "skuld",
      "source": "./plugins/skuld",
      "description": "Comprehensive estate planning assistant with state-specific intelligence for 51 jurisdictions, 7 specialized agents for document drafting, and educational guidance with professional boundaries.",
      "version": "1.5.1",
      "author": {
        "name": "AltaKleos Platform Team",
        "email": "hello@altakleos.com"
      },
      "category": "productivity",
      "keywords": ["trusts", "wills", "power-of-attorney", "healthcare-directive", "legal", "documents"]
    },
    {
      "name": "youtube-transcriber",
      "source": "./plugins/youtube-transcriber",
      "description": "Extract transcripts from YouTube videos with intelligent 3-tier fallback (yt-dlp → Browser MCP → Whisper AI), batch processing, and automatic deduplication",
      "version": "1.0.0",
      "author": {
        "name": "AltaKleos Platform Team",
        "email": "hello@altakleos.com"
      },
      "category": "productivity",
      "keywords": ["youtube", "transcript", "subtitles", "captions", "whisper", "yt-dlp", "video-to-text"]
    },
    {
      "name": "youtube-downloader",
      "source": "./plugins/youtube-downloader",
      "description": "Download videos from YouTube and 1000+ sites with quality presets, playlist/channel support, and batch processing",
      "version": "1.0.0",
      "author": {
        "name": "AltaKleos Platform Team",
        "email": "hello@altakleos.com"
      },
      "category": "productivity",
      "keywords": ["youtube", "download", "video", "audio", "yt-dlp", "playlist", "channel", "batch"]
    }
  ]
}
